{
  "id": "L-content-v2",
  "revision": 1,
  "owner": "author-a",
  "model_version": "strata/0.2-content-mediation-experimental",
  "baseline": "R0@1",
  "intent": "Explain the booking hold lifecycle.",
  "changes": [
    {
      "op": "set_item",
      "block": "booking.hold",
      "path": "description",
      "expected": {
        "kind": "value",
        "value": {
          "format": "plain-text/1",
          "text": ""
        }
      },
      "value": {
        "format": "plain-text/1",
        "text": "Background: a hold reserves one resource until its expiry; requirements and acceptance define the normative behavior."
      }
    }
  ],
  "requires_layers": [],
  "read_set": [],
  "assumptions": [],
  "acceptance": [],
  "resolution_proposals": [],
  "derived_from": null
}
